<?xml version="1.0" encoding="UTF-8"?>
<dbShard xmlns="http://ddal.raptor.studio/shard-config" xmlns:xsi="http://www.w3.org/2001/XMLSchema-instance"
         xsi:schemaLocation="http://ddal.raptor.studio/shard-config shard-config.xsd">
    <!-- 虚拟数据库管理 -->
    <virtualDBs>
        <virtualDB name="school" shardGroup="shardGroup1" rmOwner="true" sqlMaxLimit="-1">
            <table name="teacher" databaseRule="teacher-database-rule"/>
            <table name="student" databaseRule="sno-database-rule"/>
            <table name="scores" databaseRule="sno-database-rule"/>
            <table name="course" type="global"/>
        </virtualDB>
    </virtualDBs>

    <!-- 分片组 -->
    <shardGroups>
        <shardGroup name="shardGroup1">
            <shard name="shard_0" dsGroup="group_1" schema="ddal_test_0"/>
            <shard name="shard_1" dsGroup="group_1" schema="ddal_test_1"/>
            <shard name="shard_2" dsGroup="group_1" schema="ddal_test_2"/>
            <shard name="shard_3" dsGroup="group_1" schema="ddal_test_3"/>
        </shardGroup>
    </shardGroups>

    <!-- 物理数据库集群管理 -->
    <physicalDBClusters>
        <physicalDBCluster name="cluster1" type="mysql">
            <dbInstance name="inst1" hostname="127.0.0.1" port="3306" sid="" rw="W" role="M0" status="O"/>
            <dbInstance name="inst2" hostname="127.0.0.1" port="3306" sid="" rw="R" role="M1" status="O"/>
        </physicalDBCluster>
    </physicalDBClusters>
    <!--数据源管理-->
    <dataSources>
        <group name="group_1" relaCluster="cluster1">
            <dataSource user="muser" pwd="muser" dbInstName="inst1" dbDriver="jdbc">
                <params>
                    <property name="minIdle" value="1"/>
                    <property name="maxIdle" value="5"/>
                    <property name="maxTotal" value="10" />
                    <property name="timeBetweenEvictionRunsMillis" value="5000" />
                    <property name="testWhileIdle" value="true" />
                </params>
            </dataSource>
            <dataSource user="muser" pwd="muser" dbInstName="inst2" dbDriver="jdbc">
                <params>
                    <property name="minIdle" value="1"/>
                    <property name="maxIdle" value="5"/>
                    <property name="maxTotal" value="10" />
                    <property name="timeBetweenEvictionRunsMillis" value="5000" />
                    <property name="testWhileIdle" value="true" />
                </params>
            </dataSource>
        </group>
    </dataSources>
    <!-- 分片管理 -->
</dbShard>
